{
  "schema_version": "quickpls.packaged_acceptance.v1",
  "kind": "quickpls3_scoped_tauri_regression_bootstrap_v1_acceptance",
  "passed": true,
  "generated_at_utc": "2026-08-13T19:15:24.423Z",
  "completed_at_utc": "2026-08-13T19:17:09.144Z",
  "feature_id": "qpls3.standalone.regression_bootstrap",
  "method_version": "regression_bootstrap_v1",
  "catalogue_snapshot_date": "2026-08-12",
  "target": "windows_10_11_x64_packaged_tauri",
  "runtime": "tauri-webview2-cdp",
  "endpoint": "http://127.0.0.1:9222",
  "generator": "validation/v247_tauri_native_acceptance.mjs",
  "tested_product": {
    "quickpls_desktop_exe": {
      "path": "target/release/quickpls-desktop.exe",
      "size": 30507008,
      "sha256": "5b226f1c0492fa54198bc21754fe6473181a1b63bc703bb0d49f8f15d9371277"
    },
    "dist_bundle": {
      "path": "dist",
      "size": 1191494,
      "file_count": 19,
      "sha256": "364eb8ee0a73bade09dfde958755fac09983ffd34f998b41755edee95f5a8e74",
      "manifest": [
        {
          "path": "assets/NativeCalculationDialog-CekKsDqn.js",
          "size": 51101,
          "sha256": "3b3a2fb6c5f03765fa77208b7f76ddabf083710ad5c6e38fdc62f6101ec6d694"
        },
        {
          "path": "assets/NativeExportDialog-CTZOLsrg.js",
          "size": 6432,
          "sha256": "523da583f3a66f89cb2d8f11d6b122ff2aa2c03640d1dabcad00cd4ef9bfc2f2"
        },
        {
          "path": "assets/NativeGroupSetupDialog-DncLahbL.js",
          "size": 6779,
          "sha256": "2f9eb02cfd1224c3a9b3a87c94b2006d10514184b995345adf7c7238ae901190"
        },
        {
          "path": "assets/NativeHigherOrderDialog-Bn4cY5Gi.js",
          "size": 2948,
          "sha256": "08dbb627b5b031b9bad9287e7017c43277efcfdb3b3358a811a753f66eb5e609"
        },
        {
          "path": "assets/NativeModerationDialog-D2IfblSQ.js",
          "size": 3081,
          "sha256": "a7143c8cd4dfcaa4d58adffc392c4edfa4861e78970484d35b6c3683ee876840"
        },
        {
          "path": "assets/NativeResultsSurface-Bv7Fchdi.js",
          "size": 31251,
          "sha256": "2692880853872db149cfb86a7041a849e6cc114faf6dbfe571d85a54550ba79f"
        },
        {
          "path": "assets/NativeUtilityDialog-B_BR7mw4.js",
          "size": 12164,
          "sha256": "a4c73c06ffcf8b4dd5dca228a4895f7bbe7a4718ec34da32d9f568fbbf0e9f06"
        },
        {
          "path": "assets/flow-BN-PNp2v.js",
          "size": 83921,
          "sha256": "e96e69cde521273e387064b0ff3ea9f94e29834ea085646f0b8e1fe9e0ea8fde"
        },
        {
          "path": "assets/flow-BnuhLJ6X.css",
          "size": 15869,
          "sha256": "1243b61a71923367ce620fb944427c80c9b03e863e18374fcf4f74d6d06f63fc"
        },
        {
          "path": "assets/icons-CWW7Ihoi.js",
          "size": 20835,
          "sha256": "11135cfa4b1cefe02205ec00e7f23204127146720a75ccbb5941632226a4a3c6"
        },
        {
          "path": "assets/index-DBKNtbUu.js",
          "size": 528769,
          "sha256": "d37b081cac27b076af6c5c288c0280ace77424912b173849ed9517381d9879f7"
        },
        {
          "path": "assets/index-DpTHova4.css",
          "size": 74714,
          "sha256": "e756299a2d8d0620f5d62a8f60f0265b0059aa2599790474b940218826096182"
        },
        {
          "path": "assets/largeModelSmoke-PEBccAlJ.js",
          "size": 880,
          "sha256": "a4977bf130c85a688b570fb1f17f8dac958787116a585c9300f3d4c3fbd6b535"
        },
        {
          "path": "assets/nativeMga-DgYeq6DN.js",
          "size": 3108,
          "sha256": "024828f88efaf03205588f9bc34ca763bd8f484b36f5172f92d4a83ac4aa12ff"
        },
        {
          "path": "assets/publicationDiagram-BlkNs4Z4.js",
          "size": 8648,
          "sha256": "19cd3e3c69779a47c603cc3be9269a62e4871492416c549b8938250eb9e6f8df"
        },
        {
          "path": "assets/smokeRun-CMXwsrTO.js",
          "size": 7141,
          "sha256": "33388a0e9df739d8812f2a03c2980f00a3f49046375ae48c9a854d8f94f7f962"
        },
        {
          "path": "assets/tauri-CZBL8huA.js",
          "size": 15818,
          "sha256": "8fbb85b9879fc37af89bc405134891d8b7dec19829e03c6d7900ba79f71dbe77"
        },
        {
          "path": "assets/vendor-3AznE2Td.js",
          "size": 317214,
          "sha256": "7dadeaa73f481ffd1ab52c5247997462fd195062a4dbe10353701ffbbc45711f"
        },
        {
          "path": "index.html",
          "size": 821,
          "sha256": "ffa343bcc205c9541dcddd98ce187604001ef7fc3b279b6a460a25b5009b3b50"
        }
      ]
    }
  },
  "checks": {
    "workflow": {
      "passed": true,
      "ols_completed": true,
      "logistic_completed": true,
      "active_lifecycle_captured": true,
      "model_free": true,
      "source_check": "regressionBootstrapWorkflow"
    },
    "results": {
      "passed": true,
      "ols_initial_selected_table": "regression_bootstrap_summary",
      "logistic_initial_selected_table": "regression_bootstrap_summary",
      "ols_coefficient_rows": 4,
      "logistic_coefficient_rows": 4,
      "percentile_primary_present": true,
      "bca_conditional_present": true,
      "failure_disclosure_truthful": true,
      "validation_witness_not_rendered": true,
      "no_na_fabrication": true,
      "source_check": "regressionBootstrapResults"
    },
    "ols_export": {
      "passed": true,
      "workbook_sheets": [
        "Coefficients",
        "Model fit",
        "Calculation scope",
        "Regression bootstrap summary",
        "Bootstrap coefficient inference",
        "Percentile confidence intervals",
        "BCa confidence intervals (condi",
        "Fitted values and residuals",
        "Run provenance"
      ],
      "validation_witness_excluded": true,
      "witness_scan": {
        "passed": true,
        "total_members": 18,
        "scanned_xml_and_rels_members": [
          "[Content_Types].xml",
          "_rels/.rels",
          "xl/_rels/workbook.xml.rels",
          "xl/theme/theme1.xml",
          "xl/styles.xml",
          "xl/workbook.xml",
          "xl/worksheets/sheet1.xml",
          "xl/worksheets/sheet2.xml",
          "xl/worksheets/sheet3.xml",
          "xl/worksheets/sheet4.xml",
          "xl/worksheets/sheet5.xml",
          "xl/worksheets/sheet6.xml",
          "xl/worksheets/sheet7.xml",
          "xl/worksheets/sheet8.xml",
          "xl/worksheets/sheet9.xml",
          "xl/sharedStrings.xml",
          "docProps/core.xml",
          "docProps/app.xml"
        ],
        "worksheet_members": [
          "xl/worksheets/sheet1.xml",
          "xl/worksheets/sheet2.xml",
          "xl/worksheets/sheet3.xml",
          "xl/worksheets/sheet4.xml",
          "xl/worksheets/sheet5.xml",
          "xl/worksheets/sheet6.xml",
          "xl/worksheets/sheet7.xml",
          "xl/worksheets/sheet8.xml",
          "xl/worksheets/sheet9.xml"
        ],
        "worksheet_row_counts": {
          "xl/worksheets/sheet1.xml": 8,
          "xl/worksheets/sheet2.xml": 5,
          "xl/worksheets/sheet3.xml": 15,
          "xl/worksheets/sheet4.xml": 21,
          "xl/worksheets/sheet5.xml": 8,
          "xl/worksheets/sheet6.xml": 8,
          "xl/worksheets/sheet7.xml": 8,
          "xl/worksheets/sheet8.xml": 144,
          "xl/worksheets/sheet9.xml": 39
        },
        "forbidden_matches": [],
        "extraction_errors": []
      },
      "artifact_sha256": "27969c7184d31e8d37d4a54d1b29251b4fb3560eea30c8738666d9345dbfb367",
      "source_check": "regressionBootstrapOlsExport"
    },
    "logistic_export": {
      "passed": true,
      "workbook_sheets": [
        "Coefficients, Wald inference, a",
        "Model fit and likelihood-ratio",
        "Classification at probability t",
        "Binary outcome profile",
        "Estimator convergence",
        "Complete-case fitted probabilit",
        "Calculation scope",
        "Regression bootstrap summary",
        "Bootstrap coefficient inference",
        "Percentile confidence intervals",
        "BCa confidence intervals (condi",
        "Bootstrap odds-ratio intervals",
        "Run provenance"
      ],
      "validation_witness_excluded": true,
      "witness_scan": {
        "passed": true,
        "total_members": 22,
        "scanned_xml_and_rels_members": [
          "[Content_Types].xml",
          "_rels/.rels",
          "xl/_rels/workbook.xml.rels",
          "xl/theme/theme1.xml",
          "xl/styles.xml",
          "xl/workbook.xml",
          "xl/worksheets/sheet1.xml",
          "xl/worksheets/sheet2.xml",
          "xl/worksheets/sheet3.xml",
          "xl/worksheets/sheet4.xml",
          "xl/worksheets/sheet5.xml",
          "xl/worksheets/sheet6.xml",
          "xl/worksheets/sheet7.xml",
          "xl/worksheets/sheet8.xml",
          "xl/worksheets/sheet9.xml",
          "xl/worksheets/sheet10.xml",
          "xl/worksheets/sheet11.xml",
          "xl/worksheets/sheet12.xml",
          "xl/worksheets/sheet13.xml",
          "xl/sharedStrings.xml",
          "docProps/core.xml",
          "docProps/app.xml"
        ],
        "worksheet_members": [
          "xl/worksheets/sheet1.xml",
          "xl/worksheets/sheet2.xml",
          "xl/worksheets/sheet3.xml",
          "xl/worksheets/sheet4.xml",
          "xl/worksheets/sheet5.xml",
          "xl/worksheets/sheet6.xml",
          "xl/worksheets/sheet7.xml",
          "xl/worksheets/sheet8.xml",
          "xl/worksheets/sheet9.xml",
          "xl/worksheets/sheet10.xml",
          "xl/worksheets/sheet11.xml",
          "xl/worksheets/sheet12.xml",
          "xl/worksheets/sheet13.xml"
        ],
        "worksheet_row_counts": {
          "xl/worksheets/sheet1.xml": 8,
          "xl/worksheets/sheet2.xml": 15,
          "xl/worksheets/sheet3.xml": 5,
          "xl/worksheets/sheet4.xml": 5,
          "xl/worksheets/sheet5.xml": 5,
          "xl/worksheets/sheet6.xml": 144,
          "xl/worksheets/sheet7.xml": 15,
          "xl/worksheets/sheet8.xml": 21,
          "xl/worksheets/sheet9.xml": 8,